0;Do not buy. Very incompetent team. I found the game to be pretty much a scam as there isn't much to do. Raiding has become nearly impossible and you can make a full reinforced base fairly quickly. Yet it is impossible to raid. Team keeps releasing bad updates and game has been out for a while and isn't optimized. Updates that do come out are bad and ruin raiding. Pretty much a non optimized form of COD now that you can't raid with tons of lag. Game is a scam. Do not buy.
0;verall very bad PVP either does not exist or you just can survive more than 5 minWithout a squad it's just not worth itPVE almost not existingWeapon mechanics bad Building mechanics actually  imagination is the limitUpdate 1 12 2018Can't join any server.Devs have no solutions.Just deal with it.ATTENTION DO NOT BUY THIS GAME
0;Very bad game and very bad community. I'm going to unninstall this game after I write this review. Then I will kill myself and burn my computer and haunt the annoying people who keep r*ping me in this game. They don't have a life when they have 9198935902867496757q785q709278670297602786429687q908760q79867398678937967827896789768957680929562 hours on this game and they hack or are just fucking pro players and maybe they should think of getting a job or a life.
0;This game is literally becoming trash! Ive just played 6 games with hackers all in a row.... ive been on for about 35 minutes. How the hell do expect to play a game when youre getting shot through walls from a guy driving shot gun in a car across the map?
0;This game is actually a complete pile of garbage. Too many hackers and the game is so choppy and laggy that it becomes virtually unplayable for the first two three minutes because everyone is from everywhere in the world and there is a massive desync issue that is still somehow in effect. This game needs to be sold to a company that will actually better it and not one that is just going to rake in the money without making any actual improvements. Bluehole is a terrible terrible company.
0;The game is getting worse by the day.Rubberband lagsBullets not registering properly (e.g getting shot even though you're behind a wall)Poor match making system (queue for team/duo get yourself and no one else)Extremely poor chances to get any decent costumes
0;It feels that with every update they make for this game it gets worse and worse. It would be nice if the F*ckhead devs would do something to optimize this trash. It's a good game with good potential but it keeps getting ruined with every update that comes out.
0;The game is unoptimized but fun. The reason why I can't recommend this game is because 50 players in every game cant speak english (mainly bad for squads/duos) and have 1500 ping giving them an unfair advantage. It isn't racism it's practicality. MAKE BETTER CHINESE SERVERS and put them all there so we don't have to lose to people who are essentially cheating/exploiting.
0;Do you like garbage game servers? Do you like trash graphics with computer melting gpu and cpu usage? Do you like glitches random deaths by freaked out vehicles and bad physics? Well then this is a game for you. This game is 'esport ready' after all.
0;This game is extremely poorly optimized and server desync causes very strange problems. For instance while firing backwards on the back of a bike I somehow murdered my driver. Cool feature.This game will be fantastic once it is optimized further. The sheer amount of money that players have thrown at it vs the state of the game is ridiculous.
0;Battle Royale is a great genre but if you're considering this don't.This game is still broken. I don't get when people saying the game is dead when there's still more than a player playing the game. But still not defending this trash. From what I see this should be a free game so it can compete with fortnite.
0;after spending a bit of time attempting to play this game my conclusion is region locking is needed badly hacking is a every game occurance and server stability or lack of it needs addressing promply . i love the idea of this game but cannot stand its flaws esports ready as claimed it is not get to work blue hole . you have less time than you think .
0;this game is so ing trash. i paid ing 30 pounds for this ing stupid game. the hit mechanics are so wank. the gunplay is you die in t ways i just dont liek this game no more. blueballs made so much money yet cant even optimise the game. the game runs like trash. stupid bugs stupid glitches 2/10. FORTNITE IS BETTER SO THIS TRASH REALSITIC GAY ASSS GAME. I CANT W8 FOR THE SAVAAGE MAP
0;Played this game for a few hours now. The movement controls are absolute garbage. You have to play on poor control settings Everything is glitchy indicators and sound bugs make it impossible to know where you are getting shot at Asains are at the gameAlso early access they proably won't improve this game.This game will be forgotten like h1z1
0;Absolutely awful game. They haven't even attempted to fix the lag desync and cheaters. You'll get shot after you are 5 feet behind cover ran over by flying cars and get pulled back to the ground when you jump because of lag. DO NOT waste your money on this trash. Wait for something better!!!!!!!!!!!!
0;this game goin to be die soon. it's already a year and they receive so much income from this game. but they never fix this trash server trash optimization slow development now they being so greedy by disabling trading and make more paid loot boxesfor they who want to buy this game better stay away if you wont waste your money. they losing player day by day
0;Utter garbage and the owner CEO or whatever Brendan Greene is a terrible person who panders to the majority Chinese user base lag is terrbile even with a powerful computer and good ping also map design is UTTER TRASH.Would not recomend even if it became a cheap game. (would be a good f2p though)DONT BUY!
0;badly optimized laggy bad hitboxes bad terrain character posing (can't lay on the ground on some rocks)...bad coding. it takes more than 3 shots from assault rifle to down a person (didn't expect that kind of sheet from ArmA dev) BUT u can be killed with 1 shot jump punch in the head. + u can farm pointsUpdate 03.10.2018Omg this is still sooo laggy and unoptimized. No fun in getting freeze at the end of the game and crash...Why am I still playing this....yep boxes of course...
0;Becoming unplayable. Honestly the guns are trash and uncontrollable. all i can use are dmrs or snipers cause the guns are just terrible. this was the only game i used to play daily and it just got ruined. Honestly the game is basically dead to me. i would recommend anyone who wants to play a battle royale theres a few new ones that are gonna come out soon but this game is just ruined. between hackers and terrrible just terrible gun mechanics.
0;This game is so bad the character's does not even respond to the mechanical keyboard when you for example strafe left there is a slight delay before your character starts moving this does not happen in the battle royale Ring of Elysium.The delay ruins the game 100% you should fix the delay before you even release such a .
0;This game is a total non sense. Assaulted NA servers by Asian and Chinese players bad ping bad hit detection non registering shots and hackers who know's exactly where your at...don't waste your money on this. On 10 games in a row I coudnt find a speakin english partner...what a joke
0;still glitchy still desync (altho a bit better still very bad) there are alot more cheater now and when you play vs chinese players they teleport around..... i have high hopes low expectations would not buy again untill fixed also when you are sitting behind a hill or in tall grass if a player is more then a couple hundred meters away they can see you even if you cant see them because of the poor distance rendering.
0;the ing lag is so bad it takes 5 min befor you can take 1 step and there is no chanse to pick up a gun. ( and no its not my connection its the ing servers) and its not because of loading at the beginning eather sometimes im fine at first than the lag comes but sometimes its after iv ben it the game for 10 15 min. fix your servers plz
0;This game has very very bad latency issues. Behind wall no problem just shoot the wall. Houses don't spawn.... ok developers ban you for their own faults. Game is unplayable in any servers you will get 250 million chinese hackers that pubg doesn't do anything about.
0;I want so badly to play this game but between the server lag and MASSIVE amounts of cheaters it is nearly impossible. If you are reading this review I dont want you to think that there is a tollerable amount of cheaters because that is NOT the case. There is indeed AN UNORTHADOX AMOUNT OF CHEATERS!!!!!!!!!
0;I deleted this game ages ago from my library I saw updates and was thinking I would give it another shot. but WOW the game is even worse then before 0 improvement on the hit reg 0 effort from this trash developer team. Oh we need to focus on putting out new maps guns and dumb things like grips. It is just falling even further down the trash can.
0;Developers are completely incompetent.You make a couple of $100 million and you still can't do the basics of a video game. These devs do not give a sh!t. The list of unbelievable backward decisions and terrible broken updates is endless by this point.The game has not been improved it is just being haphazardly patched together with chewing gum.It has reached the point now where I would rather play Fortnite. I don't like Fortnite.